{
  "schema_version": "6.3",
  "source": { "type": "text", "ref": "inline://demo", "read_at": "2026-08-06T02:00:00.000Z" },
  "source_fingerprint": "sha256:deadbeef01",
  "items": [
    {
      "candidate_id": "C-001",
      "module_l1": "销售",
      "module_l2": "销售",
      "kind": "page_url",
      "page_id": "销售单列表页",
      "platform": "web",
      "page_url": { "template": "/sales/order/list", "absolute": false }
    },
    {
      "candidate_id": "C-002",
      "module_l1": "销售",
      "module_l2": "销售",
      "kind": "page_element",
      "page_id": "销售单列表页",
      "page_role": "主页面",
      "platform": "web",
      "element": {
        "name": "表头.设置",
        "position": "列表表头左侧齿轮",
        "input_options": "可选列←公用池",
        "interaction": "打开设置",
        "result": "本列表列变更",
        "downstream": "—",
        "backend_apis": [
          { "method": "GET", "path": "/api/v1/columns", "operation": "查询可选列" }
        ]
      }
    }
  ]
}
